{"contractVersion":"oxcribe.oxinfer.v2","requestId":"req-golden-missing","runtimeFingerprint":"fp-golden-missing","status":"partial","meta":{"oxinferVersion":"0.1.4","partial":true,"stats":{"filesParsed":5,"skipped":0,"durationMs":0,"assemblerStats":{"unresolvableMatches":0}},"diagnosticCounts":{"info":0,"warn":1,"error":0}},"delta":{"meta":{"partial":false,"stats":{"filesParsed":5,"skipped":0,"durationMs":0,"assemblerStats":{"unresolvableMatches":0}},"version":"0.1.4"},"controllers":[{"fqcn":"App\\Http\\Controllers\\UserController","method":"index","http":{"status":200,"explicit":true},"responses":[{"kind":"json_array","status":200,"explicit":true,"contentType":"application/json","bodySchema":{"items":{"properties":{"email":{"type":"string"},"name":{"type":"string"}},"type":"object"},"type":"array"},"source":"response()->json","via":"response()->json"}]}],"models":[{"fqcn":"App\\Models\\Post","attributes":[{"name":"content","via":"$fillable"},{"name":"title","via":"$fillable"},{"name":"user_id","via":"$fillable"}]},{"fqcn":"App\\Models\\User","attributes":[{"name":"email","via":"$fillable"},{"name":"name","via":"$fillable"},{"name":"password","via":"$fillable"}]}]},"routeMatches":[{"routeId":"users.index","actionKind":"controller_method","actionKey":"App\\Http\\Controllers\\UserController::index","matchStatus":"matched"},{"routeId":"users.missing","actionKind":"controller_method","actionKey":"App\\Http\\Controllers\\UserController::missing","matchStatus":"missing_static","reasonCode":"missing_static_action"}],"diagnostics":[{"code":"route.action.missing_static","severity":"warn","scope":"action","message":"runtime route action has no matching static controller analysis","routeId":"users.missing","actionKey":"App\\Http\\Controllers\\UserController::missing"}]}
