{"contractVersion":"oxcribe.oxinfer.v2","requestId":"req-golden-invokable","runtimeFingerprint":"fp-golden-invokable","status":"partial","meta":{"oxinferVersion":"0.1.4","partial":true,"stats":{"filesParsed":5,"skipped":0,"durationMs":0,"assemblerStats":{"unresolvableMatches":0}},"diagnosticCounts":{"info":1,"warn":0,"error":0}},"delta":{"meta":{"partial":false,"stats":{"filesParsed":5,"skipped":0,"durationMs":0,"assemblerStats":{"unresolvableMatches":0}},"version":"0.1.4"},"controllers":[{"fqcn":"App\\Http\\Controllers\\InvokeUserController","method":"__invoke","http":{"status":200,"explicit":false},"responses":[{"kind":"json_object","status":200,"explicit":false,"contentType":"application/json","bodySchema":{"type":"integer"},"source":"response()->json","via":"response()->json"}]},{"fqcn":"App\\Http\\Controllers\\UserController","method":"index","http":{"status":200,"explicit":true},"responses":[{"kind":"json_array","status":200,"explicit":true,"contentType":"application/json","bodySchema":{"items":{"properties":{"email":{"type":"string"},"name":{"type":"string"}},"type":"object"},"type":"array"},"source":"response()->json","via":"response()->json"}]}],"models":[{"fqcn":"App\\Models\\Post","attributes":[{"name":"content","via":"$fillable"},{"name":"title","via":"$fillable"},{"name":"user_id","via":"$fillable"}]},{"fqcn":"App\\Models\\User","attributes":[{"name":"email","via":"$fillable"},{"name":"name","via":"$fillable"},{"name":"password","via":"$fillable"}]}]},"routeMatches":[{"routeId":"users.index","actionKind":"controller_method","actionKey":"App\\Http\\Controllers\\UserController::index","matchStatus":"matched"},{"routeId":"users.invoke","actionKind":"invokable_controller","actionKey":"App\\Http\\Controllers\\InvokeUserController::__invoke","matchStatus":"matched"},{"routeId":"auth.user","actionKind":"closure","matchStatus":"runtime_only","reasonCode":"closure_action"}],"diagnostics":[{"code":"route.runtime_only.closure","severity":"info","scope":"route","message":"runtime route uses a closure action and is runtime-only in contract v2","routeId":"auth.user"}]}
